category_name,name,rating,votes,address
Banquet_Halls,Shree Lakshmi Function Hall,4.1,9,"26, New Thiruvalam Road Vit Road, KATPADI VELLORE, Vellore - 632002, Near Chittoor Bus Stand"
Banquet_Halls,Lts Mahal Ac,5.0,9,"-203/1B2 6B , Ramalingam Nagar, Arni Road, Edayansathu, Vellore - 632002, Near HP Petrol Bunk"
Banquet_Halls,Pm Mahal Ac,4.5,4,"5/4, Vellore to Arni Road-Adukkamparai, Adukkamparai, Vellore - 632011, Opposite to EB Office"
Banquet_Halls,Dhanamsathyan Mahal Ac,4.8,4,"1/118, Dharmapuri Main Road, Kakankar Railway Station, Vellore - 635654, Kakangarai"
Banquet_Halls,Ghayathri Mini Hall Ac,5.0,4,"18, Arni Road, Bagayam, Vellore - 632002"
Banquet_Halls,Hotel Mount Paradise,3.7,4,"37, Vellore Bye Pass Road, Sathuvacheri, Vellore - 632009, Next to Collector Office"
Banquet_Halls,Baby Residency,4.0,2,"7, Officers Line Anna Salai, Krishna Nagar, Vellore - 632001, Opp Dig Bangla"
Banquet_Halls,Sri Narayani Mahal,4.5,2,"rumalaikodi, Ariyur, Vellore - 632055, Near Golden Temple"
Banquet_Halls,Durga Mahal Ac,4.1,6,"padi to Gudiyattam Road, Katpadi Road, KATPADI VELLORE, Vellore - 632002, Kizhvadugankuttai"
Banquet_Halls,Srinivas Thirumana Mandapam,3.5,6,"6 Vaisha Complex, Arni Road, Bagayam, Vellore - 632002, Near Govt Arts College"
Banquet_Halls,Benzz Park,3.9,5073,"4, Dharmaraja Koil Street, Old Katpadi Road, Vellore Ho, Vellore - 632001, Next to Pachayappas Silk & Old National Theatre"
Banquet_Halls,LTS Mahal AC,4.9,5073,"203/1B2 6B, Ramalingam Nagar, Edayansathu, Vellore - 632002, Near HP Petrol Bunk"
Banquet_Halls,Bagiyam & Nadham Function H..,4.5,5,"ST FLOOR LRK EMPIRE BUILDING, # 58 ANNA SALAI, KRISHNA NAGAR, Vellore - 632001, NEXT To LAKSHMI THEATER"
Banquet_Halls,Palar Residency,3.5,5,"2/16 Vellore City Centre, Anna Salai, Officers Line, Vellore Ho, Vellore - 632001, Opposite Voorhees School"
Banquet_Halls,Sri Gajalakshmi Arangam,4.1,5,", Arni Road, Sainathapuram, Vellore - 632001, Near Pillaiyar Kovil Opposite"
Banquet_Halls,Baby Mahal Ac,4.4,5," No 10 New No 131, Masilamani Mudaliar Hostel Road, Vellore HO, Vellore - 632001, Near Dhandapani Muthaliyar Mandapam"
Banquet_Halls,A S Gurusamy Mahal Ac,4.5,460,"nnai to Siththur Main Road, Pennai Kutroad, Tiruvalam, Vellore - 632515"
Banquet_Halls,Tamil Mahal Thirumana Manda..,4.2,460,"icut Road, Walajapet, Vellore - 632513, Nearby NH Bridge Anaicut Road"
Banquet_Halls,A S Gurusamy Mahal Ac,4.3,25,"padi to Chennai Salai, VIT Road, Sevur, Vellore - 632106"
Banquet_Halls,Ksm Mahal,4.1,25,"24/25, Kannan Nagar Sripuram Main Road, Ariyur, Vellore - 632055, Near Golden Temple"
Banquet_Halls,A S Gurusamy Mahal Ac,4.3,122,"padi to Chennai Salai, VIT Road, Sevur, Vellore - 632106"
Banquet_Halls,Darling Residency,4.2,122,"11/8, Anna Salai, Krishna Nagar, Vellore - 632001, Near Roundtana"
Banquet_Halls,GRT Regency Sameera Hotel,4.3,7659,"145, New Bypass Road, Vellore Fort, Vellore - 632004, Opposite Green Circle"
Banquet_Halls,Hotel Aavanaa Inn,3.4,7659,"144, Arcot Road, Vellore Bazaar, Vellore - 632004, Opposite CMC Hospital"
Banquet_Halls,Surabi International Hotel,4.0,5162,"33, Officers Line, Vellore Ho, Vellore - 632001, Opposite Co Operative Bank"
Banquet_Halls,Raja Rani Residency,3.8,5162,"1A, TNHB Phase 1, Krishnagiri Main Road, Tirupattur, Tirupattur - 635601"
Banquet_Halls,Sri Annamalaiyar Residency,3.8,1601,"27, New Katpadi Road, Vellore - 632004, Near Green Circle"
Banquet_Halls,P Dhandapani Mudaliar Mahal,4.1,1601,"7/1, Masilamani Mudaliar Hostel Road, Krishna Nagar, Vellore - 632001, Near New Corporation Building"
Banquet_Halls,Sangamam Mahal,3.9,1464,"34, Officer's Line, Vellore Ho, Vellore - 632001, Near Surabi Residency"
Banquet_Halls,Pmp Dhanalakshmi Mahal,4.1,1464,"C1, C2, C3, P M P Dhanalakshmi Mahal, Sathuvacheri, Vellore - 632009, Valallar"
Banquet_Halls,A S Guruswamy Mahal,4.1,437,"4, Ponnai Thiruvalam Road, Tiruvalam, Vellore - 632515"
Banquet_Halls,Gayathri Mahal,4.0,437,"82,Guruthoppu,Sathuvachari,Vellore., Sathuvacheri, Vellore - 632009, Allahabad Bank Near"
Banquet_Halls,Azhagambal Krishnaswamy Mud..,3.8,429,"236, Ariyarur Road ,Kamaraj Nagar, Thorapadi, Vellore - 632002"
Banquet_Halls,G S Mahal,3.7,429,"534, Bangalore Road, Konavattam Vellore, Vellore - 632013"
Banquet_Halls,Hotel Grand Krishna,3.5,413,"171, Arcot Main Road, Alamelumangapuram, Vellore - 632009, Near Bangalore Highway"
Banquet_Halls,Gvrs Radha Vilvam Thirumana..,3.8,413,"42, 7th East Main Road, Gandhi Nagar Vellore, Vellore - 632006"
Banquet_Halls,Spk Mahal Walajapet,4.0,396,"havabalan Nagar, Ammoor Road, Walajapet, Vellore - 632513"
Banquet_Halls,Rani Mahal Kalyana Mandapam,3.9,396,"23, Officers Line, Krishna Nagar, Vellore - 632001"
Banquet_Halls,Thillai Mahal,3.7,373,"48, Thennandiyalam, Melvisharam, Nandiyalam, Vellore - 632517"
Banquet_Halls,Balaji Mahal,4.3,373,"liyappa Nagar, Thangal, Thangal, Vellore - 632513"
Banquet_Halls,Dev Paradise Lodge,4.2,292,"1,, Dharumapuri Main Road, Tirupattur Bazaar, Vellore - 635602, Near Raja Rani Hotel"
Banquet_Halls,Sri Kumaran Mahal,3.8,292,"72, Arcot Road, NH-47, Alamelumangapuram, Vellore - 632009, Near Sarva Sandharam Government Office"
Banquet_Halls,Thanjammal Duraiswamy Mudal..,3.9,288,"njammal Duraiswamy Mudaliyar Kalyana Mandapam, #1/4, Agathi Krishnappa Chetty Street, Vellore Ho, Vellore - 632001, Vellore"
Banquet_Halls,V A K Vijaya Mahal,3.7,288,"ranampet, Gudiyattam, Gudiyattam Railway Station, Vellore - 635803"
Banquet_Halls,Thuluva Velaalar Marriage H..,3.8,286,"toorvellore Highway (Sh9), Suthanthira Ponvizha Nagar, Gandhi Nagar, Gandhi Nagar East, Vellore - 632006"
Banquet_Halls,Hotel Kumaran Millenium Res..,3.7,286,",, Katpadi Highway Road Thiru Nagar, Thiru Nagar, Vellore - 632006, Near Rangalaya Kalyana Mandapam"
Banquet_Halls,Nathan Mahal,3.5,265,"a Nayagam, Krishna Nagar Extension, Tollgate, Palavansathu, Rn Palayam Road, Rn Palayam, Vellore - 632001"
Banquet_Halls,RAMANI SHANKAR MAHAL,4.5,265,"48, Chennai, Vellore - 632517"
Banquet_Halls,Btm Mahal,3.6,261,"24, BTM Mahal, 1st West Cross Road, Gandhi Nagar Vellore, Vellore - 632006, Near Silk Mill Bus Stop"
Banquet_Halls,S J S Mahal Sholighur,3.7,261,"linghur, Sholingur, Vellore - 631102"
Banquet_Halls,KKR Manikkammal Mahal,4.0,198,"apulam , Puthur Vellore, Sh126, Arcot, Arcot, Arakkonam Ocheri Road, Panapakkam, Vellore - 631052"
Banquet_Halls,R N Function Palace Kalayan..,3.9,198,"23, Officers Line, Vellore Ho, Vellore - 632001"
Banquet_Halls,Mangalaraman Marriage Hall,3.5,186,"ariyastreet , Ezhil Nagar, Krishna Nagar, Rv Nagar, Ezhi Nagar Road, Krishna Nagar, Vellore - 632001"
Banquet_Halls,Royal Palace Kalyana Mandap..,3.8,186,"304, Bangalore Road, Vellore Ho, Vellore - 632001, Konavattam"
Banquet_Halls,Sri Lalitha Mahal,3.8,186,"upattur, Tirupattur - 635601, Near State Bank"
Banquet_Halls,Hasini Mahal,3.6,186,"ruvalam, Vellore - 632515"
Banquet_Halls,R N Function Palace,3.9,228," 92, Officers Line, Anna Nagar, Vellore - 632001, Next Rani Mahal"
Banquet_Halls,Nandini Mahal,4.3,228,". Vattam, Jolarpettai, Vellore, Palnankuppam Kootu Road, Palnankuppam Kootu Roadtirupathur Main Road, Jolarpettai, Vellore - 635851"
Banquet_Halls,Vkr Mahal,3.8,185,"24b, Sannathi Veedhi, Pallikonda, Vellore - 635809, Near Ranganathar Temple"
Banquet_Halls,Sri Vishnu Mahal,3.5,185," Road, Walajapet, Vellore - 632513"
Banquet_Halls,Priya Mahal,3.5,141,"ayam, Vellore, Arni Road, Bagayam, Vellore - 632002, Otteri Bus Stop"
Banquet_Halls,Priya Mahal,3.5,141,"2/91, Otteri Road-Bagayam, Vellore - 632002, Otteri Bus Stop"
Banquet_Halls,M L Marriage Hall,3.8,141,"padi, Vellore - 632007, VIT College Road, Old Katpadi Near Chennai Bakery"
Banquet_Halls,Radha Manjunath Marriage Ha..,3.4,141,"127, Pallikonda, Vellore - 635809"
Banquet_Halls,G K Mahal,3.7,140,"upet, Annasalai Main Road, Melvishram Vellore, Vellore - 632509, Melvisharam"
Banquet_Halls,MTS Thirumanamandapam,3.7,140,"ruthani Road, Sholingur, Vellore - 631102, Opposite Hp Petrol Bunk"
Banquet_Halls,Vpn Mahal,3.8,139," Mahal 3A, Annadhana Cahathiram Road, Sholingur, Vellore - 631102, Near Thakangulam"
Banquet_Halls,M.m.e.s Function Hall,4.4,139,", Navlock, Annasalai Main Road, Melvishram Vellore, Vellore - 632509, Opps Uamantpet Mark"
Banquet_Halls,Sri Selva Vinayagar Mahal,4.1,133,"pamaram St, Velapadi, Vellore - 632001"
Banquet_Halls,Dg Mahal,3.9,133,"asamangalam Bus Stop, KATPADI VELLORE, Vellore - 632002"
Banquet_Halls,Ammai Appar G S Mahal,3.8,121,"4E, Arcot Main Road, Alamelumangapuram, Vellore - 632009, Opposite Krishna Mahal"
Banquet_Halls,Ranjan Mahal,3.6,121," Road, Poigai, Vellore - 632114"
Banquet_Halls,Vasavi Kalyanamandapam,3.5,117,"16/40, Kannigaparameswari Koil Street, Vellore Bazaar, Vellore - 632004"
Banquet_Halls,Baby Mahal,3.5,117,"ional Highway 46, Abdullah Puram, Vellore - 632010"
Banquet_Halls,Dhanabagyam Kalyana Mandapa..,3.6,116,"hanthira Ponvizha Nagar, 4th East Main Road, Gandhi Nagar East, Vellore - 632006, Gandhi Nagar"
Banquet_Halls,Ajb Mahal,3.7,116,"1, Durgha Street, Tirupattur Fort, Vellore - 635602, Near Kottai Sivan Kovil"
Banquet_Halls,Avm Mahal,3.4,112,"/1 Palanisami St, Tirupattur, Vellore - 635601, Opp Daily Mart"
Banquet_Halls,V.s.b.vijay Mahal,3.7,112,"inchipuram Road, Virinjipuram, Vellore - 632104"
Banquet_Halls,KSM Mahal,4.1,111,"alakshmi Nagar Kamaraj Nagar Thorapadi Vellore, Ariyur Vellore, Vellore - 632055"
Banquet_Halls,Ckc Marriage Hall,3.9,111," Nagar, Tirupattur, Vellore - 635601, Tirupattur"
Banquet_Halls,Uma Elumalaiyan Kalyana Man..,3.8,98,"liyappa Nagar, Madras Bombay Trunk Road, Walajapet, Vellore - 632513"
Banquet_Halls,JP Kalyana Mandapam,3.9,98,"ian Oil Petrol, Vellore - 632515, Opposite National Highway 4"
Banquet_Halls,AGS Kalyana Mandapam,3.9,97,"48, Swamy Chetti Street, Tirupattur, Vellore - 635601, Near AGS Mall"
Banquet_Halls,Agr Marriage Mahal,3.3,97,"hya Naga, Vellore, Sh4, Arcot, Arcot, Vilupuram Arcot Road, Vellore - 632521"
Banquet_Halls,VDS Mahal,4.1,97,"te Highway 4, Vilupuram Arcot Road, Timiri, Vellore - 632512"
Banquet_Halls,Sri Krishnaveni Mahal,3.6,97,"lajapet, Thenkadappanthangal, Vellore, Nh4, Arcot, Arcot, Madras Bombay Trunk Road, Thenkadapanthangal, Vellore - 632513"
Banquet_Halls,Aranya Mahal,3.7,94,"311, Bangalore Chennai Highway, Perumugai, Vellore - 632009, Opposite Ford Car Show Room"
Banquet_Halls,S S Mahal,3.5,94,"303, Arni Road, (Nh 234), Vellore, Kaniyambadi, Vellore - 632102"
Banquet_Halls,Solai Function Hall,4.0,92,"216, Tnhb Phase-1, Sathuvachari, Sathuvacheri, Vellore - 632009"
Banquet_Halls,India Medical Association H..,3.8,92," Katpadi, Gandhinagar West, 4th West Cross Road, Gandhi Nagar East, Vellore - 632006, Gandhi Nagar"
Banquet_Halls,J. S Mahal,3.6,82," Rafi Nager, Vannivedu, Vellore - 632513, Ooratchi Nagara Building"
Banquet_Halls,Ramamoorthy Mahal,3.7,82,"28, Shankar Nagar, Sholinghur, Sholingur, Vellore - 631102"
Banquet_Halls,Grace Flowers,4.0,80,"4 SLN Plazza 1st East Main Road, Odai Pillaiyar Kovil, KATPADI VELLORE, Vellore - 632002, Gandhi Nagar"
Banquet_Halls,Sri Dhanalakshi T Velu Kaly..,3.7,80,"54/A, Arni Road, Bagayam, Vellore - 632002, Virupatchipuram"
Banquet_Halls,Bhuvaneswari Mahal,3.7,78,"13/11, SOUTH AVUNE ROAD, Sathuvacheri, Vellore - 632009, Near Court Phase 2, Near Gh"
Banquet_Halls,KPS Thirumana Mandapam,3.9,78,"34 E, Ammoor Road, Ranipet Vellore, Vellore - 632509, Near Muthukadai Junction"
Banquet_Halls,Sri Narayana Mahal Ac,4.3,77," NARAYANA MAHAL AC, Katpadi Road Chennarayanapalli, Gudiyattam Railway Station, Vellore - 635803, FRONT OF ARYA VIDHYSHRAM SCHOOL"
Banquet_Halls,Thangaraj Palace,4.3,77," SALAI, Walajapet, Vellore - 632513, Nera AAA COLLEGE"
Banquet_Halls,Thangaraj Palace,4.3,75," Road, Walajapet, Vellore - 632513, Near Bt AAA A Colloge"
Banquet_Halls,Zaibun Marriage Hal,3.4,75,"t Area, Tirupattur - 635601"
Banquet_Halls,Goplaya kalyana mandapam,3.6,70,"dhi Nagar, Gudiyattam, Gandhi Nagar West, Vellore - 632006"
Banquet_Halls,K K C Marriage Hall,3.8,70," Gandhi Road, Kudiyanakuppam, Vellore - 635851"
Banquet_Halls,Sakthi Mahalakshmi Mahal,3.7,68,"llinghur, Vellore Sh61, Arcot, Walajah Sholinghur Arakonam Road, Sholingur, Vellore - 631102"
Banquet_Halls,Vijaya Saravana Mahal,4.0,68,"2, Tvk Salai, Thiruppattur Vellore, Vellore - 635601"
Banquet_Halls,Yelagiri Hall,4.0,68,"10, Krishna Nagar, Vellore - 632001, Next to Darling Residency, Officers Line"
Banquet_Halls,Naveen mahal kalyana mandap..,3.9,68,"lore Road, Odugathur, Vellore - 632103, Odugathur"
Banquet_Halls,Sri Lakshmi Ponnusamy Marri..,3.9,66,"65/2b, Katpadi Road, Raja Koil, Gudiyattam Railway Station, Vellore - 635803, Near Rajagopal Polytechnic College"
Banquet_Halls,Saravana Mahal,3.8,66," 358/c, Arcot Main Road, Rangapuram, Vellore - 632009, Opposite to Grand Krishna Hotel"
Banquet_Halls,Meenakshi Kalyana Mandapam,3.9,65,"46, Phase 2, Sathuvachari, Sathuvacheri, Vellore - 632009"
Banquet_Halls,Shree Ranjini Function Hall,4.5,65,"arajar Nagar,Sripuram, Main Road, Thorapadi, Vellore - 632002"
Banquet_Halls,Sri Vari Mahal,3.9,58,"/A Sri Vari Complex Ocheri Vellore Dst, Chennai - Bengaluru Hwy, Ocheri, Vellore - 632531"
Banquet_Halls,Saradambal Srinivasamudally..,3.9,58," 85, Officers Line, Krishna Nagar, Vellore - 632001"
Banquet_Halls,Sri RPG Marriage Hall,3.7,57,"lore, Nh46, Poigai, Vellore - 632114"
Banquet_Halls,Kariya Chetty Chenniyammal ..,3.7,57,"chur, Natrampalli Tirupattur Kuppam Road, Pachur, Vellore - 635854, Kamatchiyamman Temple"
Banquet_Halls,Gp Rani Mahal,3.5,55,"ajapet, Vellore - 632513"
Banquet_Halls,Vaniga Vaisiya Mandapam,3.8,55,"i Chettystreet, Sripuram, Saidapet Vellore, Vellore - 632012"
Banquet_Halls,Srinivasa Kalyana Mandapam,3.8,55,"i Road, Bagayam, Vellore - 632002"
Banquet_Halls,Sengunthar Thirumana Mandab..,4.1,55,"epet, Gudiyattam, Gudiyattam Railway Station, Vellore - 635803"
Banquet_Halls,Mmp Mini Mahal,3.8,55,"/1a, Ammoor Road, Manthangal, Walajapet, Vellore - 632513, Registor Office"
Banquet_Halls,Mmp Mini Mahal,3.8,55,"ajapet, Vellore - 632513"
Banquet_Halls,SRR Thirumana Mandapam,3.7,49,"lore Main Road, Ocheri, Vellore - 632531, Near On The Way to Sirukarumbur"
Banquet_Halls,Raja Rani Mahal,3.6,49,"110/17, Narasinga Swamy Madam Street, Sullivananpet, Vellore - 632001, Opposite Dinakaran Theatre"
Banquet_Halls,V.S.B.Mahal,3.4,49,"88, Vellore - 632104"
Banquet_Halls,Janaki Mahal,3.4,49,"i Road, Bagayam, Vellore - 632002"
Banquet_Halls,Thirumagal Kalyana Mandapam,3.4,48,"hanthira Ponvizha Nagar, Bharathi Nagar, 4th East Cross Road, Gandhi Nagar East, Vellore - 632006, Gandhi Nagar"
Banquet_Halls,K.c. Mahal,4.1,48,"araj Nagar, Vellore - 632057"
Banquet_Halls,Saradhambal Srinivasan Muda..,3.8,45,"24B, Officers Lane, Allias Anna Salai, Krishna Nagar, Vellore - 632001, Near Lakshmi Theatre"
Banquet_Halls,P N R Mahal,3.7,45,"appandal, Vellore - 632318"
Banquet_Halls,Udayam Mahal,3.4,45," Mbt Road, Kaveripakkam, Vellore - 632508"
Banquet_Halls,Y G Mahal,3.5,45,"haimedu.K.V.Kuppam, Vellore - 632201"
Banquet_Halls,Kailasam Chinnakkani Mandab..,3.5,43,"a Nagar, Tirupattur Bazaar, Vellore - 635602, Near Govt. Primary School"
Banquet_Halls,Kgn Mahal,3.4,43," Vasoor, Sathuvachari, Kanchipuram Vellore Road, Alamelumangapuram, Vellore - 632009, Alamelumangapuram"
Banquet_Halls,Sri Kamakshi Mahal,3.3,43,"thithangal, Vellore, Nh234, Katpadi Road, Vellore - 632201"
Banquet_Halls,M S Mahal,3.7,43,"ruvalam, Vellore - 632515"
Banquet_Halls,Varthaga Sangam Mahal,3.7,42,"i Chetty St, Kakankarai, Vellore - 635601"
Banquet_Halls,VM Kuppu Swamy Marriage Hal..,3.3,42,"28, Kaveripakkam, Vellore - 632508"
Banquet_Halls,S S Mini Hall,4.9,41,"galore to Chennai Highway, Poigai, Vellore - 632114, Near Upstairs Central Bank Of India"
Banquet_Halls,Sri Udhaya Mahal,4.0,41,"maraipakkam, Thamaraipakkam, Vellore - 632504"
Banquet_Halls,Arunachala Kalayana Mandapa..,3.9,41,"40, Azad Road, Bagayam, Vellore - 632002, Thorapadi"
Banquet_Halls,Balaji Marriage Hall,3.7,41,"umbakkam, Kattalai Village, Vellore - 632508"
Banquet_Halls,Subalakshmi Mahal,3.3,39," 76, Old No. 173, Phase1, Sathuvachari, South Avenue Road, Sathuvacheri, Vellore - 632009"
Banquet_Halls,Selva Valarmathi Mahal,3.7,39,"/3, State Highway 131, Rayappan Nagar, Tirupattur, Vellore - 635601, Amirtha Higher Secondary School-Tirupattur"
Banquet_Halls,Narayana Mandiri Valandiyam..,3.6,38," 11, Arcot Road , Arcot Road, Rangapuram, Vellore - 632009, Near Mangala Vinayagar Temple"
Banquet_Halls,Msks Kalyana Mandapam,3.6,38,"langai Road, Ammoor, Vellore - 632501"
Banquet_Halls,Rdm Thirumana Mahal,3.6,38,"11/5, Walaja Road, Sholingur, Vellore - 631102"
Banquet_Halls,Sri Sundram Mahal,3.3,38,"riage Hall, Thiruvannamalai Main Road, Tirupattur, Vellore - 635601, Near Vengalapuram"
Banquet_Halls,P.M Mahal,4.4,38,"5/4 Vellore, To, Tamil Nadu, Arni Road, Sainathapuram Vlr, Vellore - 632001"
Banquet_Halls,Vijayalakshmi Celebration H..,3.7,38,"Dharmalingam Street, Poonthotam, Velapadi, Vellore - 632001, Near Harris Gas Godown"
Banquet_Halls,Surya Mahal,3.3,38,"eripakkam, Vellore - 632508"
Banquet_Halls,AVS Kalyana Mandapam,4.0,38,"tty Street, Sholingur, Vellore - 631102"
Banquet_Halls,Mks Mahal (Thirumana Mandap..,4.2,34," Mahal, Mittur, Vellore - 635710, Mittur Ricemill Bus Stop"
Banquet_Halls,Yrtm Marriage Hall,3.7,34,"4, Virinchipuram Road, Vaduganthangal, Vellore - 632204"
Banquet_Halls,Ajanta Mahal,3.4,34,"hanthira Ponvizha Nagar, Gandhinagar West, Gandhi Nagar Vellore, Vellore - 632006"
Banquet_Halls,Kannan Mahal,3.3,34,"26, Anna Salai, Officers Line, Vellore Ho, Vellore - 632001, Near Kanna  Hotel"
Banquet_Halls,Susee Soundar Raja Nadar Ha..,3.6,34," 90, Nadar Complex, Arni Road, Bagayam, Vellore - 632002, Opposite to Janaki Mahal"
Banquet_Halls,Sarojini Venkatesh Kalyana ..,3.4,34,"88, Paradarami, Vellore - 632603"
Banquet_Halls,Pathmavathi Kalyana Mandapa..,3.9,34,"anur Road, Chinnamottur, Vellore - 635851"
Banquet_Halls,K M A Mahal,3.6,34,"garampattu Gate, Arani Taluk, Sh 132, Kammasamudram, Vellore - 632319"
Banquet_Halls,Sri Shiva Shakthi Mahal,3.0,33,"ot Road, Vellore - 632009, Near Shwathi Medical"
Banquet_Halls,Susila Ammal Vengatesa Mudh..,2.9,33," 8, Contractor Manikkam Mudaliar, Kosapet, Vellore - 632001, Near Dinakaran Delite Appartment"
Banquet_Halls,Sri Aishwaryam Mahal,4.8,31," Aishwaryam Mahal, Mahathma Gandhi Street, Kaveripakkam, Vellore - 632508, Thirupparkadal Perumal Temple"
Banquet_Halls,Sri Vadamalai Thirumana Man..,3.3,31,"nnarampatti, Kurumberi Road, Perambattu, Vellore - 635652, Near Thiruvannamali Road"
Banquet_Halls,Sarathy Marriage Hall,4.2,30,"icut, Vellore - 632101"
Banquet_Halls,Chithra Mahal,3.5,30,"iyattajm Manin Road, Paradarami, Vellore - 632603, Near Guriji Matriculation School"
Banquet_Halls,S.A.Mahal,3.1,28," St, E.B. Road, Shenbakkam, Vellore - 632008, Near Rashi Tailor"
Banquet_Halls,Paras Mahal,3.8,28," Thiruvallam Road, Bharamanpuram Post,Thangal Village, KATPADI VELLORE, Vellore - 632002"
Banquet_Halls,Rk Thirumana Mahal,3.3,28,"rch Colony, Viruthampattu, Vellore, Tamil Nadu, Tk Road, Vellore - 632006"
Banquet_Halls,Vasantha Marriage Hall,3.3,28," Shollinghur, Vellore, Sh54, Arcot, Arcot, Chittoor Thiruthani Road, Sholingur, Vellore - 631102"
Banquet_Halls,Rgs Thirumana Mandapam,3.7,28,"46, Phase 1, Sathuvachari, Sathuvacheri, Vellore - 632009"
Banquet_Halls,SMS Mahal,3.6,28,"il Nadu, Kanchipuram Vellore Road, Thenkadapanthangal, Vellore - 632513"
Banquet_Halls,Sri Kesava Perumal Marriage..,3.3,26,"100/1, Vellore - 631102, Sumathi Theater Opp"
Banquet_Halls,Adilakshmi Kalyana Mandapam,3.7,26,"hanthira Ponvizha Nagar, Gandhi Nagar, Gandhi Nagar West, Vellore - 632006"
Banquet_Halls,Sournabaai Maargabandhu Mar..,3.9,25,"apalayam, Pazhayanur Main Road, Timiri, Vellore - 632512"
Banquet_Halls,Subramani Sampurna Mahal,3.9,25," Natrampalli, Vellore - 635852"
Banquet_Halls,Narayana Mahal,3.8,24,"G,G Colony, Tirupattur, Vellore - 635601"
Banquet_Halls,Vasavi Kalyana Mandapam,3.3,24,"i Chettystreet, Sripuram, Saidapet, Saidapet, Vellore - 632002"
Banquet_Halls,RSJ Imran Mahal,3.2,24," Imran Mahal, Saduperi Main Road, Saduperi, Vellore - 632002, Near KH Exports Company"
Banquet_Halls,Thai Sri Naga Thirumana Man..,3.2,24,"amangalam, Achamangalam, Tirupattur - 635651"
Banquet_Halls,LKS Function Hall,4.5,24," Complex, Arni Road, Sainathapuram, Vellore - 632001, Near Krishnaswamy Higher Secondary School"
Banquet_Halls,Vijaya Lakshmi Marriage Hal..,4.1,24,"46, Kaveripakkam, Vellore - 632508"
Banquet_Halls,Jayakrishna Mahal,3.6,23,"darapalli, Vellore - 635854"
Banquet_Halls,Sengunthar Thirumana Mandab..,3.2,23,"am Street, Nethaji Nagar, Sathuvachari, Sathuvacheri, Vellore - 632009"
Banquet_Halls,Sri Narayana Marriage Hall,4.1,23,"4, Arcot, Paradarami Arcot, Vellore - 632512"
Banquet_Halls,Sulochana Arjunan Marriage ..,4.0,23,"apalli,Thirupathoor, Velakalnatham, Vellore - 635854, Opp Petrol Bunk"
Banquet_Halls,N K Devaraj Gounder Mahal,3.9,21,"hukkupalli, Peddakallupalli, Vellore - 635801"
Banquet_Halls,K.I.S. Marriage Function Ha..,3.9,21,"nnamadhar Sahebstreet, Tamil Nadu, Tirupattur, Tirupattur - 635601"
Banquet_Halls,Jsr Kusturi Mahal,3.9,21,"nnakallupalli, Vellore - 635851"
Banquet_Halls,Tmt Mahal,3.7,21,"anipakkam, Thangam Nager, Vellore - 632101, Opp Saibaba Temple"
Banquet_Halls,Kavalar Thirumana Mandapam,3.2,21,"anthapuram, Fort Round Road, Kosapet, Vellore - 632001"
Banquet_Halls,Sengunthar Thirumana Mandap..,4.2,21,"apandal, Vellore - 632318"
Hospitals,Indira Super Speciality Hos..,4.1,306,"320 / 3A1, Chittoor Main Road,, Gandhi Nagar West, Vellore - 632006"
Hospitals,Manisundaram Medical Missio..,3.9,306,"288 Phase1, South Avenue Road, Vallalar, Sathuvacheri, Vellore - 632009, Near More Super Market"
Hospitals,Mumme Hospital,4.2,147," Mumme Hospital,No 15/2, Masilamani Hostel Road, Vellore Ho, Vellore - 632001"
Hospitals,Mumme Hospital,4.2,147," No 15/2 New No 28, Masilamani Hostel Road, Krishna Nagar, Vellore - 632001"
Hospitals,Sri Narayani Hospital and R..,3.8,31,"ayani Hospital and Research Centre, Ariyur Vellore, Vellore - 632055, Near Golden Temple, Sripuram Thirumalakodi"
Hospitals,Dhanya Medical Centre,4.0,31,"19, Pillaiyar Koil Street, Velappadi, Vellore - 632001"
Hospitals,Vellore Speciality Centre,4.1,31," 1315, South Avenue Road, Sathuvacheri, Vellore - 632009, Near By Vellore District Court Behine Avin Milk Dairy"
Hospitals,Nithya Sugam Ayurvedic Hosp..,4.5,31,"hya Sugam Vaithiya Salai, No. 7 Nethaji Garden, Ammoor Koot Road, Ammoor,, Ammoor, Vellore - 632501, Ammoor Koot Road CSI Church Nearby"
Hospitals,Indira Nursing Home,4.1,565,"452, Main Bazzar Road Saidapet, Vellore - 632001, Near CMC Hospital"
Hospitals,Nalam Medical Centre and Ho..,4.1,565,", A, Arcot Road, Sathuvacheri, Vellore - 632009, Near Collectorate"
Hospitals,Nithya Sugam Ayurvedic Hosp..,4.5,2,"hya Sugam Vaithiya Salai, No. 7 Nethaji Garden, Ammoor Koot Road, Ammoor,, Ammoor, Vellore - 632501, Ammoor Koot Road CSI Church Nearby"
Hospitals,Usha Nursing Home,3.8,2,"85, Filter Bed Road, Krishna Nagar, Vellore - 632001, Near Vellore Silk House & BPR Nursing College, Vellore Bazaar"
Hospitals,Sri Narayani Hospital And R..,4.1,39,"puram, Thirumalaikodi, Ariyur, Vellore - 632002, Near Golden Temple,"
Hospitals,Aruna Eye Hospital,3.9,39,"19/1, Officers Line, Voorhees College, Vellore - 632001, Near Apsara Cinema"
Hospitals,Sri Sakthi Amma Hospital,3.9,1469,"14/87, Housing Board Phase-1, 7th Cross, Sathuvacheri, Vellore - 632009, Near Vallalar Nagar"
Hospitals,Gaurav Homeopathic Clinic,4.2,1469,"p No 2, New Bus Stand Street, Kalanaur Rohtak, Rohtak - 124113, Near New Bus Stand"
Hospitals,Theneerajwellness.com,4.4,46,"e No. 40, Sheesham Jhari,, Sewanand Ashram Rd,, Rishikesh City, Rishikesh - 249201, Muni Ki Reti,"
Hospitals,Christian Medical College H..,4.4,46," Scudder Road, Vellore Bazaar, Vellore - 632004, Near Fort"
Hospitals,Dr. Mohans Diabetes Special..,4.7,67,"13, 7th East Main Road, Gandhi Nagar Vellore, Vellore - 632006, Gandhi Nagar"
Hospitals,Christian Medical Hospital,4.3,67," Building Main Block, IDA Scudder Road, Cmc, Vellore - 632004, Opposite State Bank Of India"
Hospitals,ARC Fertility Hospitals,4.8,1290,"102/283, Katpadi Road, Thottapalayam, Vellore - 632012, Opposite New Bus Stand & Next to Hotel Saravana Bhavan, Vivekanandar Nagar"
Hospitals,Dr. Agarwals Eye Hospital,4.5,1290,"18, Officers Lane, Voorhees College, Vellore - 632001, Near Apsara Theatre"
Hospitals,Apollo K H Hospital,4.2,1033,"ipet to Vellore By Pass Road, Melvishram Vellore, Vellore - 632509, Near Melvishram"
Hospitals,Naruvi Hospitals,4.3,1033,"72, Collectors Office Road, Chennai Bengaluru Highway, Vellore Collectorate, Vellore - 632004"
Hospitals,Nalam Medical Centre And Ho..,4.1,635,"44,, Arcot Road, Sathuvacheri, Vellore - 632009, Near Collectorate"
Hospitals,Christian Medical Hospital,4.1,635,"n Road, Bagayam, Vellore - 632002, Opposite State Bank Of India"
Hospitals,Sri Saai Ideal Dental Care,4.8,565,"illium College Road,, Gandhi Nagar Vellore, Vellore - 632002, Near Apollo Pharmacy"
Hospitals,Vasan Eye Care Hospital,4.2,565,"30/1, Officers Line, Krishna Nagar, Vellore - 632001, Near Khanna Hotel"
Hospitals,Vellore Homeo Care,4.8,410,"29/108, Najam Centre, Virudhambattu, Vellore - 632006, Near Vishnu Theatre"
Hospitals,Sandhya Hospital,3.7,410,"565, 16th Street, Sathuvacheri, Vellore - 632009, Opposite Vallalar Tank"
Hospitals,Vellore Government Hospital,4.1,231,"i Road, Adukkamparai, Vellore - 632011, Near Bagayam"
Hospitals,Dr. Sivakumar Multi Special..,3.6,231,"3, Arcot Road, Sathuvacheri, Vellore - 632009, Opposite Collector Office"
Hospitals,Hospital Annexe & Ywca Cant..,3.7,135,"ttapalayam, Vellore - 632012"
Hospitals,Indira Nursing Home,3.6,135,"452, Main Bazaar Road, Saidapet, Vellore - 632012, Near CMC Hospital"
Hospitals,Raj Nursing Home,4.3,132,"5, Ponniamman Kovil Street, Sainathapuram, Vellore - 632001, Near EB Office"
Hospitals,Raj Nursing Home,4.3,132,"5, Ponniamman Koil Street, Sainathapuram, Vellore - 632001"
Hospitals,Mental Health Centre,4.4,130,"ayam, Vellore - 632002, Near Bagayam Police Station, Old Bus Stand"
