category_name,name,rating,votes,address
Chemists,Sri Ram Medicals,4.7,3,"285, Pillayar Koil Street, Thottapalayam, Vellore - 632012, Near Avanayan Hotel Opst"
Chemists,Rajini Medicals,4.7,3,"lore, Nh46, Arcot, Arcot, Arapakkam, Vellore - 632517"
Chemists,Bharti Pharmacy,4.7,3,"t Office Street, Sholingur, Vellore - 631102"
Chemists,Sri Srinivasan Medicals,4.6,3,"58, GPH Road, Krishna Nagar, Vellore - 632001, Opposite to ESIC Hospital"
Chemists,Medplus Melvisharam Khadar ..,4.3,3,"r No, Ground Floor Shop No 1 2 3&4, 1/1, Khaderpet, Vellore - 632509"
Chemists,Suresh Medical,4.3,3,":1 AKMC Angaadi, Avalkara Street, Vellore HO, Vellore - 632001, Opp Raja Theater"
Chemists,Sri Balaji Medicals,4.2,3,"2/19, Arni Main Road, Adukkamparai, Vellore - 632011, Opposite VGMC Hospital"
Chemists,New Dinesh Pharmacy,4.0,3,"285, Phase-I, Sathuvacheri, Vellore - 632009, Nearby Annapoorna Mess"
Chemists,Sri Narayani Medicals,4.0,3,"440/1a Phase III, Nethaji Bose Street, Sathuvacheri, Vellore - 632009"
Chemists,Tnmsc District Drug Warehou..,4.0,3,"Sanatorium Campus, Adukkambarai Post, Adukkamparai, Vellore - 632011"
Chemists,Om Sri Ganapathi Medicals,4.0,3,"i Road, Timiri, Vellore - 632512"
Chemists,Siva Medicals,4.0,3,"20, Cutchery Street, Tirupattur, Tirupattur - 635601, Near Arignar Anna Primary School"
Chemists,Siva Medicals,4.0,3,"20, Cutchery Street, Thiruppattur Vellore, Vellore - 635601, Opposite Arignar Anna nagaratchi School"
Chemists,Sk Pharmacy,3.6,3,"kar Mundy St, Sripuram, Saidapet, Vellore - 632002, Masuthi Near"
Chemists,Sri Balaji Medical,3.6,3,"rumalaikodi, Ariyur Vellore, Vellore - 632055"
Chemists,Appolo Hospitals Enterprise..,3.5,3,"21, Post Office Street, Sholingur, Vellore - 631102, Near Aarthi Collections"
Chemists,Sree Sutha Homeo Pharmacy,3.3,3," Voorhees School Complex, Kosapet, Vellore - 632001, Opposite to Hospital Gate"
Chemists,Modern Medical Shop,3.3,3,"4/11 Shop No 3, Nawab Nagar, Vellore - 632517, Near Balamurugan Temple"
Chemists,Sooriya Medicals,2.8,3,"34/29, 7th East Main Road, Gandhi Nagar Vellore, Vellore - 632006, Near EB Stop"
Chemists,Medplus,5.0,3,"141/71, 143/72, Chittoor Road, Katpadi, Vellore - 632007, Opposite Taj Complex"
Chemists,Ganesh Medical,5.0,3,"ili, Nemili Senthamangalam Road, Sendamangalam, Vellore - 631051"
Chemists,Kumaran Medicals,5.0,3,"91/C  24, Azad Road, Thorapadi, Vellore - 632002, Opposite Murugar Temple"
Chemists,Jan Aushadhi,5.0,3,"1/174, National Highway 46, Puttuthakku, Vellore - 632517"
Chemists,Velmurugan Medicals,5.0,2,"10, Auxilium College Road, Gandhi Nagar Vellore, Vellore - 632006, Near Roundana"
Chemists,new golden medicals,5.0,2,"2 AKMC Angadi, Officers Line, Vellore - 632001, Opposite to Raja Theatre"
Chemists,Bluesun Medicals,5.0,2,": 56/1, Bangalore Road, Shenbakkam, Vellore - 632008, Near Shenbakkam EB Bus Stop"
Chemists,Naga Medicals,5.0,2,"akadai Street , Marakadai Street, Arasamarapet, Vellore - 632004, Near Ing Vysya Bank"
Chemists,Jeevitha Medicals,5.0,2,"17, Councelor Abdul Latheep Street, Rn Palayam, Vellore - 632001, Thorapadi"
Chemists,Siva pharmaceuticals,5.0,2,"tha, arasamaram pet, Arasamarapet, Vellore - 632004"
Chemists,Mala Medicals,5.0,2,"141/2e, Nethaji Road, Shenbakkam, Vellore - 632008, Near Gandhi Statue"
Chemists,Shree Medicals,5.0,2,"176/A, IDA Scudder Road, Cmc, Vellore - 632004, Near Hotel Saravana Bhavan"
Chemists,Sangeetha Medicals,5.0,2,"79, Arni Road, Sainathapuram, Vellore - 632001, Near Bus Stop"
Chemists,Sri Rajarajeswari Medicals,5.0,2,"15/1, New Katpadi Road New Bus Stand, Vellore Ho, Vellore - 632001, Near Chelliammana Kovil"
Chemists,Jeevan Pharmacy,5.0,2,"71, Arni Road, Otteri Road-Bagayam, Vellore - 632002, Next to MKS Electronics"
Chemists,Shri Sai Medicals & Clinic,5.0,2,"/1a, Phase Iii, Sathuvachari, Vallalar, Double Road, Sathuvacheri, Vellore - 632009, Opposite Yuva Market"
Chemists,Sri Balaji Medicals,5.0,2,"4/98, Mel Mayil Road, Kv Kuppam, Vellore - 632201, Opposite Bus Stand"
Chemists,Muhyi Enterprises,5.0,2," 3/31, Annai Therasa Street, Veppur, Vellore - 635803, Veppur"
Chemists,Uma Medicals,5.0,2,", Bajanai Kovilstreet, Odugathur, Vellore - 632103"
Chemists,Sri Variyar Medicals,5.0,2,"k, (, Kanchipuram Main Road, Pallur, Vellore - 631051, Opposite Thirumalpur R.S) Pallur Arakonam Tk Vellore D.t"
Chemists,Medcare Pharmacy,5.0,2,"nson Baby Products In, No 27, Iii, Fort Area, Jinna Road, Tirupattur, Vellore - 635601"
Chemists,Habeeb Stores,5.0,2,"upattur, Vellore - 635601"
Chemists,New Sapthagiri Medicals,5.0,2,"594 Tnhb, Krishnagiri Road, Thiruppattur Vellore, Vellore - 635601, Opp Raja Rani"
Chemists,Raja Medicals,4.8,2,"28, Collectrate New Byepass Road, Vellore Bazaar, Vellore - 632004, Near Jayanthi Residency"
Chemists,Star Pharmacy,4.8,2,"1, Chennai Salai VIT Road, Katpadi, Vellore - 632007, Near Bank Of India"
Chemists,Siva Sakthi Medical,4.8,2," Police Station Road, Jolarpettai, Kodiyur, Vellore - 635851"
Chemists,Annai Medicals,4.7,2,"1/73, Vallimalai Road, Katpadi, Vellore - 632007, Nearby Jothi College"
Chemists,Jan Aushadhi,4.5,2,"521, Phase 2, RTO Office Road, Sathuvacheri, Vellore - 632009, Near Ethiraj Matriculation Higher Secondary School"
Chemists,Swiss Medicals,4.5,2,"32/A, Arcot Road, Vellore Bazaar, Vellore - 632004, Opposite CMC"
Chemists,Rajesh Medicals,4.5,2,"80A, Azad Road, Thorapadi, Vellore - 632002, Near Thorapadi Jail, Periya Allahpuram"
Chemists,Geetha Medicals,4.5,2,", Bazaar Street, Ammoor., Ammoor, Vellore - 632501"
Chemists,Aishwarya Medical Shop,4.5,2,"3, VIT ROAD, Katpadi, Vellore - 632007, Chittoor Bus Stand"
Chemists,Kalpana Medicals,4.5,2,"linghur, Vellore, Post Office Street, Sholingur, Vellore - 631102"
Chemists,Krishna Medicals,4.5,2," cinna road Main Market, Tirupattur, Vellore, jinna road, Tirupattur, Vellore - 635601, Near ambetgar Statue"
Chemists,Babu Medicals,4.3,2,"63/1, Pandiyan Complex, Veppamara Street (PSM Street), Velapadi, Vellore - 632001, Near Annamalaiyar Hospital"
Chemists,Leena Industries,4.3,2,"na Industries, Nimeli, Kunnathur, vellore - 632510"
Chemists,Suresh Medicals,4.0,2,"1, Anna Salai, Vellore Bazaar, Vellore - 632004, Rajan Theatre Opp"
Chemists,Apollo Pharmacy,4.0,2,"4/85, Katpadi Road, Kv Kuppam, Vellore - 632201"
Chemists,Thirumalai Medicals,4.0,2,"harikuppam, Vellore - 632520"
Chemists,Sri Suki Pharmacy,4.0,2,"c10/7, South Service Road, Sathuvacheri, Vellore - 632009, Near Sbi E Corner,Vallalar"
Chemists,Om Shakthi Medicals,4.0,2,"3/3, Mettupalayam Main Raod, Mettupalayam Main Raod, Adukkambarai, Vellore - 632011, Opposite Government Hospital"
Chemists,Logesh Medicals,4.0,2,"53/6, Arni Main Road, Virupakshipuram, Vellore - 632002, Near Palavansathu Kuppam"
Chemists,Sk Swamy Medicals,4.0,2,"avenpet, Krishna Nagar, Vellore - 632001"
Chemists,Ragavendra Pharmacy,4.0,2,"ot Road, Sathuvacheri, Vellore - 632009, Sathvacheri"
Chemists,Shifa Medicals,4.0,2," Annasalai Main Road, Melvisharam, Vellore - 632509"
Chemists,Seenu Medicals,4.0,2,"iamman Koil St, Valumbakkam, Kaveripakkam, Vellore - 632508"
Chemists,Sri Kumaran Medical,3.8,2,"23/2, Filter Bed Road, Vellore Ho, Vellore - 632001, Near Indian Bank"
Chemists,A L Nathan Medical Shop,3.7,2,"5,Shop No 3 & 4, Pudhu Street, Kagithapattarai, Vellore - 632012, Near Kagithapattarai"
Chemists,Sathya Medical & General St..,3.5,2,"rupattur, #7a. A2 Palanisamy Road, Thiruppattur Vellore, Vellore - 635601, Opposite Arts Collage"
Chemists,Vadamalai Medicals,3.5,2,"17, Krishnagiri Road, Tirupattur, Vellore - 635601, Near Meenakshi Theatre"
Chemists,Sri Lakshmi Medicals,3.5,2,"71 Batti Street,Velapadi, Sankaranpalayam, Vellore - 632001, Near Fluteron Finance Office"
Chemists,Arogyapharmacy,3.5,2,"11&12, D-BLOCK, MUNICIPAL COMMERCIAL COMPLEX, G.H.ROAD, Gudiyattam Railway Station, Vellore - 635803, Opposite to Hospital"
Chemists,Sri Agro Service,3.5,2,"veeranam, Vellore - 632508"
Chemists,Sri Jai Maatutheevanam,3.5,2,"inaickenpatti, Vellore - 635602"
Chemists,Sri Dhanalakshmi Medical Sh..,3.0,2,"tipet, Ambur Bypass Road, Chinnavarikkam, Vellore - 635808"
Chemists,Siva Medicals,2.8,2,"2, Old Masuque Street, Rn Palayam, Vellore - 632001"
Chemists,Jeevan Pharmacy,2.8,2,"1 C S I Complex, Arni Road, Sainathapuram, Vellore - 632001, Opposite Jayanthi Bakery"
Chemists,Jeevan Pharmacy,2.5,2,"89/1, Officers Line, Krishna Nagar, Vellore - 632001, Near Anna Salai,Opposite Diya"
Chemists,Sugam Pharmacy,5.0,2,"upattur, Vellore - 635601"
Chemists,Sastha Medicals,5.0,2,"4/B/51-A, South Agraharam Street, Thiruppattur Vellore, Tirupattur - 635601"
Chemists,Rajan Medicals,5.0,1,"48/1, Battai Street, Velapadi, Vellore - 632001"
Chemists,Kumaran Medicals,5.0,1,"121, Bus Road, Odugathur, Vellore - 632103"
Chemists,Magi Medicals,5.0,1,"213/4, Kaanar Street, Vellore Kasba, Vellore - 632001, Near Vasanthapuram Railway Gate"
Chemists,Arokiam Dr I Clinic,5.0,1,"ar 239, 49 Asiriyar Nagar 49 Asiriyar Nagar, Vellore Ho, Vellore - 632001"
Chemists,Sri Lakshmi Medicals,5.0,1," M.B.T. Road, Walajapet, Vellore - 632513, Opp to Church"
Chemists,Om Sakthi Medicals,5.0,1,"nathapuram, Vellore, Tamil Nadu, Thennamaram Street, Vellore Bazaar, Vellore - 632004"
Grocery_shops,Akshaya Super Market,5.0,2,"65 A, Big Street, Puttuthakku, Vellore - 632517, Near Indian Bank"
Grocery_shops,B K S Traders,4.1,2,"116/129, Bangalore Road, Shenbakkam, Vellore - 632008, Near Dhinamalar Office"
Grocery_shops,Joes Super Market,5.0,169,"1, Thiruvalam Main Road, Karnambut, Vellore - 632519, Near B&B Mayflower"
Grocery_shops,Harish Food Zone,4.3,169,"8/1, Officers Line, Vellore Bazaar, Vellore - 632004, Opposite Hotel Kanna"
Grocery_shops,BKS Traders,4.0,1,"169, Bangalore Road, Konavattam Vellore, Vellore - 632013"
Grocery_shops,Anuragha Foodland,4.0,1,"30, 1st East Main Road, Gandhi Nagar Vellore, Vellore - 632006, Opposite VST Motors"
Grocery_shops,More For You,3.8,479,"58/589, Osoor Main Road, Vellore Bazaar, Vellore - 632002, Near Swetha Dental Hospital"
Grocery_shops,More For You,3.8,479,"se 1, Sathuvacheri, Vellore - 632009, Opposite Govt School,Vallalar"
Grocery_shops,Nilgiris,3.7,34,"660, RTO Road, Sathuvacheri, Vellore - 632009, Near Bombay Anandabavan"
Grocery_shops,More For You,3.8,34,"98/3, Krishna Complex, Arani Road, Rathinakulam Street, Voorhees College, Vellore - 632001, Near CMC Eye Hospital"
Grocery_shops,Harish Food Zone,4.2,237,"98, Katpadi Road, KATPADI VELLORE, Vellore - 632002, Opposite Aascar Theater, Suthanthira Ponvizha Nagar"
Grocery_shops,Sri Vasavi Super Market,4.0,237," Vasavi Mahal, G Floor, MBT Road, Walajapet, Vellore - 632513, Opposite to Taluk Office"
Grocery_shops,Sangeetha Stores,4.8,221,"navattam, Bangalore Road, Vellore HO, Vellore - 632001, Near Mosque"
Grocery_shops,Karpagam Co-Op Supermarket,4.0,221,"asalai, Bishop David Nagar, Kosapet, Vellore - 632001"
Grocery_shops,Sai Yuva Mart,3.8,183,"7 Annai Terasa, 8th Street Double Road, Sathuvacheri, Vellore - 632009, Near Holy Cross Back Side,Vallalar"
Grocery_shops,Vrs Super Market,3.7,183,"ies Hostel, Vit University, Vellore Engg College, Vellore - 632014"
Grocery_shops,Kannan Stores,4.3,148," Rao Nagar, Andal Nagar, KATPADI VELLORE, Vellore - 632002, Katpadi"
Grocery_shops,Veera Hyper Market,4.1,148,"575/24, Arcot Road, Rangapuram, Vellore - 632009, Near Sp Highway Inn"
Grocery_shops,Vijay Store,4.1,92,"or, Ussoor, Vellore - 632105"
Grocery_shops,Kamal Store,4.2,92,"l Kidangustreet, Timiri, Vellore - 632512, Near Bus Stand"
Grocery_shops,Om Sakthi Super Market,4.3,54,"langunta, Vellore - 635852"
Grocery_shops,K S M Stores,4.3,54,"rapadavedu, Katpadi, Vellore Road, Katpadi, Vellore - 632007"
Grocery_shops,Manis Super Store,3.9,49,"arpettai, Vellore - 635851, Parsampettai, Thirupattur"
Grocery_shops,Manikam Department Store,3.7,49,"riyalam, Vellore - 635851"
Grocery_shops,Arun General Stores,4.3,45,"undarayapuram, Ranipet, Mukundarayapuram, Vellore - 632405"
Grocery_shops,Kavi Medicals & Supermarket,4.2,45,"46, SH 43, Pallikonda, Vellore - 635809, Near Bus Stand"
Grocery_shops,Selvaraj Nadar Store,4.3,42,"t Bazaarstreet, Sholinghur, Sholingur, Vellore - 631102"
Grocery_shops,Singapore Super Market,3.6,42,"rampalli, Vellore - 635852"
Grocery_shops,Sri Subhiksha Stores,4.3,37,"7 Dharmalingamsalai, S M Nagar Poonthotam, Velapadi, Vellore - 632001"
Grocery_shops,Palanimurugan Supermarket,4.0,37,"11, New Street Ammoor Walajapet, Tk, Ranipet, Ranipet Vellore, Vellore - 632509"
Grocery_shops,Tamil Stores,3.4,25,"hiyamangalam, Poigai, Vellore - 632114"
Grocery_shops,Dk Supermarket,4.4,25,"/7, Arakonam Main Road, Sholingur, Vellore - 631102, Near Tvs Opp"
Grocery_shops,Revathee Colour Prints,4.4,24,"20/4,, Vaidhyachetty street, Vellore Bazaar, Vellore - 632002, old bus stand"
Grocery_shops,Brr Provision Stores,3.9,24,"8/1, Amirthi Road, Pennathur, Vellore - 632058, Near Indian Bank Near"
Grocery_shops,More Market,3.7,24,"ok Nagar, Teacher's Colony, 3rd Parallel Main Road, Tirupattur, Tirupattur - 635601, Tirupattur"
Grocery_shops,Malathi Stores,3.6,24,"ional Highway 234, Virupatchipuram, Bagayam, Vellore - 632002"
Grocery_shops,Sulaiman  Store,4.4,24,"02, Kmaraj Street, Ariyur Vellore, Vellore - 632055"
Grocery_shops,Shri Kopika Departmental St..,4.1,24,", Phase 1, South Avenue Road, Sathuvacheri, Vellore - 632009, Backside Of State Bank"
Grocery_shops,Sri Venkatesvara Stores,3.5,24,"thai Medu, Karadikudi, Vellore - 632107"
Grocery_shops,Aadhilakshmi Hyper Market,5.0,24,"shna Street, Ranipet Industrial Estate, Vellore - 632403, Rajiv Ghandhi Nagar"
Grocery_shops,Lvk Stores,3.7,21,"injur, Vellore - 632006"
Grocery_shops,Aks Super Market,4.2,21,"linghur, Sholingur, Vellore - 631102"
Grocery_shops,SUJA Super Mart,4.1,20,"dhi Nagar, Ambur, Tamil Nadu, Periyankuppam, Vellore - 635814"
Grocery_shops,R S Velu Stores,3.7,20,"t Bazaar Street, Sholinghur, Sholingur, Vellore - 631102"
Grocery_shops,Sakthi Maligai,3.6,20,", Edastreet, Salavenpet, Sullivananpet, Vellore - 632001"
Grocery_shops,K H Traders,5.0,20,"ajapet, Vellore - 632513"
Grocery_shops,Thirumurugan Stores,4.5,18,"93, Aroct Road, Sathuvacheri, Vellore - 632009, Opposite Muthu Mansion"
Grocery_shops,V.P. Maligai,4.3,18,"1, Ezhil Nagar Main Road, Allapuram, Thorapadi, Vellore - 632002"
Grocery_shops,Periya Vailambadi,4.3,18,"nna Vailambadi Road, Vellore - 632510"
Grocery_shops,Dhanalakshmi Stores,4.0,18,"ambakkam, Chennai, Vellore - 632502"
Grocery_shops,Dhanashri Supermarket,3.6,17,": 508/C, Hari Om 1st Street,Phase3, Sathuvacheri, Vellore - 632009, Nearby Water Tank,Vallalar"
Grocery_shops,Perumal Stores,4.7,17,"3a, Palani Achari St, Salavenpet, Palani Achari St, Choolai Medu, Salavenpet, Krishna Nagar, Vellore - 632001"
Grocery_shops,Sri Thirumalai Professional..,3.6,16,"padi Gudiyattam Main Road, Veppanganeri, Vellore - 632201, High School Near"
Grocery_shops,Sri Raja Rajeshwari Stores,4.9,16," Sankaranpalayam Road, Sasthri Nagar, Veerasamy Nagar, Krishna Nagar, Vellore - 632001"
Grocery_shops,Kurumberi X Road,4.4,15,"nnarampatti, Tirupattur Main Road, Vellore - 635652"
Grocery_shops,Arun Store,3.9,15,"1, Vaduganthangan, Vikramachi, Katpadi Road, Vaduganthangal, Vellore - 632204"
Grocery_shops,K Vasudevan Store,3.4,14,"15, M.P. Sarathy Nagar Kagithapatarai,, Kagithapattarai, Vellore - 632012, Chennai Silks Back Side"
Grocery_shops,Sri Balaji Stores,3.8,14,"/232, Market St, Timiri, Vellore - 632512"
Grocery_shops,Kumarasan Maligai Kadai,3.8,14,"knankuppam, Vadakkupattu Road, Vadakkupattu, Vellore - 635801"
Grocery_shops,M R Strores,4.8,14," D/16,, Long Bazaar,, Vellore Ho, Vellore - 632001"
Grocery_shops,Selvi Supermarket,4.8,11,"33, Allapuram, Vinayagapuram, Ezhil Nagar Road, Krishna Nagar, Vellore - 632001"
Grocery_shops,Nds Store,4.4,11,"ruvalam Road, Ponnai, Vellore - 632514"
Grocery_shops,Arun Stores,4.1,11,", Bazaar Street, Sholinghur, Sholingur, Vellore - 631102"
Grocery_shops,Lokesh Stores,4.0,11,"hmapuram, Vellore - 632014, Chennai Salai"
Grocery_shops,Guna Stores,3.5,11,"ruvalam, Vellore - 632515"
Grocery_shops,Vishva Store,3.5,11,"nemili, Vellore - 604505"
Grocery_shops,Vigneshwaran Stores,5.0,11,"ru St, Ezhil Nagar, Ramset Nagar, Thorapadi, Vellore - 632002"
Grocery_shops,Neahru Street,4.9,11,"hur, Sattur, Vellore - 632521"
Grocery_shops,Shri Mahalakshmi Stores Thi..,4.7,11,"i Mahalakshmi Stores Thimiri, Kavanur Road, Timiri, Vellore - 632512"
Grocery_shops,M. R. Stores,4.5,11,"6 Long Bazar,, Long Bazzar, Vellore Bazaar, Vellore - 632004, Opp to Bombay Anand Bhavan"
Grocery_shops,Daily Grocery,4.5,10,"/2, Annasalai, Melvisharam, Vellore - 632509"
Grocery_shops,Sai Kirana Stores,4.5,10," 7/117, Saravanastreet, Anaicut St, Highway Road, Walajapet, Vellore - 632513, Banglore Highway"
Grocery_shops,Chandru Maligai kadai,4.5,10,"3/1, Manibarathi Street, Sundarampalli, Vellore - 635654"
Grocery_shops,Thirupathi Store,3.4,10,"murungai, Vellore - 635812"
Grocery_shops,Sri Siwa Stores,4.6,10," Siwa Stores, Jamalpuram Road, Ussoor, Vellore - 632105, Near Gov Boys Hr Sec School"
Grocery_shops,M S Stores,4.2,10,"hamizh Nagar, Muthamizh Nagar Road, KATPADI VELLORE, Vellore - 632002, Katpadi"
Grocery_shops,Revathi Store,4.1,10,"iyambadi, Vellore - 632102"
Grocery_shops,Mohan Stores,3.8,10,"vampatti, Salem Main Road, Elavampatti, Vellore - 635602"
Grocery_shops,Ealumalai Provisional Store..,2.6,9,"ambuttu, Perampattu Road, Perambattu, Vellore - 635652"
Grocery_shops,K C Kannan,5.0,9,"a St, Kalinjur, Vellore - 632006"
Grocery_shops,Janarthanan Provisional Sto..,4.9,8,"53, Katpadi Road, Kilalathur, Vellore - 635803, Near Kudiyatham"
Grocery_shops,Sri Balaji Stores,4.7,8," 285/3, Phase-III, Sathuvacheri, Vellore - 632009, Near Angel Tailors"
Grocery_shops,Jayam Stores,4.6,8," Periyar Veedhi, Rangapuram, Vellore - 632009, Next Ezhil Stores"
Grocery_shops,Murugan Maligai Store,4.3,8,"landram, Mullandrum, Vellore - 632512"
Grocery_shops,Green Spices,4.9,8,"- 109, Mundy Street, Vellore Bazaar, Vellore - 632004"
Grocery_shops,Sri Olaikann Vinayagar Agen..,4.9,8," I 1/197, Anna Nagar, Perumugai, Vellore - 632009"
Grocery_shops,Madina Stores,4.7,8,", Annasalai Main Road, Melvisharam, Vellore - 632509"
Grocery_shops,Kani Stores,4.6,8,"avattam, Bangalore Road, Vellore HO, Vellore - 632001, Near Blue Sun"
Grocery_shops,Rk.store Provision & Genera..,4.1,7,"5&6 Cah Road, Melvisharam, Vellore - 632509"
Grocery_shops,Vsp Supermarket,5.0,7,"rumalpur, Vellore - 631051"
Grocery_shops,TJ Supermarket,4.8,6,"47, LPM Street, Kosapet, Vellore - 632001, Near Dinakaran Apartment"
Grocery_shops,Kalaivani Store,4.7,6,", Ponnai Thiruvalam Road, Main Road, Main Roadvallimalai Road, Vallimalai, Vellore - 632520"
Grocery_shops,Nadeem Maligai,4.6,6,"if Nagar, Fort Area, Tirupattur, Tirupattur - 635601"
Grocery_shops,Sri Senthil Store,4.3,6,"n Nagar, Arappakkam, Puttuthakku, Vellore - 632517"
Grocery_shops,M S Pal Gova Kampani,4.3,6," Motur Kathapadi.Rod, Kosavanpudur, Vellore - 635803"
Grocery_shops,Mrk General Store,4.2,6,"10, Varadharaja Perumal Eaststreet, Fort Area, Tirupattur Bazaar, Vellore - 635602"
Grocery_shops,Zam Zam Store,4.1,6,"thustreet , 66, Lalapet Road, Walajapet, Vellore - 632513"
Grocery_shops,J P Rice Selling Store,4.0,6," 43/7,, Periya Allapuram, Vellore Ho, Vellore - 632001, Opposite to Deboer Hostel,"
Grocery_shops,Zuhair Store,4.0,6,"d, Timiri, Vellore - 632512"
Grocery_shops,Pooncholai Medical Shop,4.0,6,"47/5, Krishnagiri Main Road, Tirupattur, Tirupattur - 635601, Near Icici Bank"
Grocery_shops,Thulasi Kumar Maligai & Xer..,3.8,6,"100/62A, Mariyamman Kovil Street, Panapakkam, Vellore - 631052, Near Zinnov Management"
Grocery_shops,Jaya Store,3.8,6,"Tv Malai Dt, No:1/163, Sivan Koilstreet, Village, Cheyyar, Sengadu, Vellore - 604505"
Grocery_shops,Thanashree Super Market,3.6,6,", Phase 3, Vallalar, Hari Om 1st Street, Sathuvacheri, Vellore - 632009, Near Rangapuram"
Grocery_shops,Thodari Grpups SRRR,3.6,6,"st Cross Cutstreet, Teacher's Colony, Tirupattur, Vellore - 635601"
Grocery_shops,Ok Stores,3.5,6,"avattam Main Road,, Konavattam Vellore, Vellore - 632013, Near Sasi Mobiles"
Grocery_shops,S S Traders,3.5,6,"109, Mundy Street, Vellore Bazaar, Vellore - 632004"
Grocery_shops,Srinivasa Stores,4.7,6,"97, Shokalinglinga Nagar, Konavattam, Vellore - 632013, Near By Royal Kalyana Mandabam"
Grocery_shops,N S Store,4.6,6,"na Chowk, Melalathur, Vellore - 635806"
Grocery_shops,S.G.Manogar Supermarket,4.4,6,"epet, Gudiyattam, Gudiyattam Railway Station, Vellore - 635803"
Grocery_shops,Jansi General Store,4.2,6,"iyur, Vellore - 635851"
Grocery_shops,Sri Mahadev Stores,4.1,5,"105, Mundy Street, Vellore Bazaar, Vellore - 632004, Near Old Bus Stand"
Grocery_shops,Sri Vignesh Super Bazaar,4.1,5,"GCP Empire, Ground Floor, Alangayam, Vellore - 635701, Beside Venkateswara Jewellers"
Grocery_shops,Mahaveera Provision,3.8,5," 183/184, Long Bazaar, Vellore Bazaar, Vellore - 632004"
Grocery_shops,VSA Provision Store,3.8,5,"tu Street, Saidapet Vellore, Vellore - 632012, Sripuram"
Grocery_shops,M N Store,3.8,5,"Odayamuthur, Anganatha Valasai Road, Vellore - 635652"
Grocery_shops,Jaisankai Maligai,3.6,5,"rampalli, Vellore - 635852"
Grocery_shops,Nagaraj Vegetables Shop,3.2,5,"huvachari, Perumugai, Alamelumangapuram, Vellore - 632009, Near By Hotel Grand Krishnna"
Grocery_shops,Aathma Eusi Pvt,3.2,5,"halampattu R.f, Vellore - 632113"
Grocery_shops,Ration Shop,3.2,5,"arpettai, Vellore - 635851"
Grocery_shops,Rajendiran Stores,3.0,5,"navoor, Karnavur, Vellore - 631052"
Grocery_shops,Sri Vasai Maligai,5.0,4,"8,Bazar Street, Bajana Kovil Street, Kilvaithinankuppam, Kv Kuppam, Vellore - 632201"
Grocery_shops,Thirumathy Shopping Complex,5.0,4,"2, Kurusilapattu, Vellore - 635702"
Grocery_shops,Sri Murugan Stores,5.0,4,"upattur, Vellore - 635601"
Grocery_shops,Ammoor Exports,4.8,4," St, South Saidapet, Ammoor, Vellore - 632501"
Grocery_shops,Chidambaram Maligai Store,4.5,4,"3/190, East Coast Road, Alangayam Road, Vengalapuram, Vellore - 635653"
Grocery_shops,Sri Chelliyamman Stores,4.3,4,"ot Road, Rangapuram, Vellore - 632009"
Grocery_shops,Thangam Super Market,4.3,4,"uvarajapet, Guruvarajpet, Vellore - 631101"
Grocery_shops,Vellorefresh,4.0,4,"1 New Labbai St Rn Palayam, Vellore Kasba, Vellore - 632001"
Grocery_shops,Sundar Organic Chekku Oil M..,4.0,4," College Road, Vallalar Nagar Extension, Rv Nagar, Sainathapuram, Vellore - 632001"
Grocery_shops,MITTUR Tamilnadu,4.0,4,"eetha And Indra Agencies, Mittur, Vellore - 635710"
Grocery_shops,Santhi Supermarket,4.0,4,"upattur, Vellore - 635601"
Grocery_shops,Priyakalaivani Provisional ..,3.9,4,"'A, Paaristreet, Ezhil Nagar, Ramset Nagar, Thorapadi, Vellore - 632002"
Grocery_shops,Noor Store,3.9,4,"30, Jinna Road, Iii, Fort Area, Tirupattur, Tirupattur - 635601, Behind Gf Mahal"
Grocery_shops,Svs Super Market,3.9,4,"upattur, Vellore - 635601"
Grocery_shops,Subhasree Organic,3.8,4,"62, Sripuram Road, Thorapadi, Vellore - 632002, Near Periyaallapuram"
Grocery_shops,Taj Provisional Store,3.5,4,", Mullai Nagar, Puram Road, Vellore - 632006"
Grocery_shops,Tirumalai Molayar Street,3.5,4,"ras Bombay Trunk Road, Walajapet, Vellore - 632513"
Grocery_shops,M A R  Stores,3.2,4,"lore Cantonment, Vellore, Katpadi Road, Thottapalayam, Vellore - 632012"
Grocery_shops,Devi Store,3.0,4,"47/3, Gandhi Nagar West, Vellore - 632006, Behind Odapillayar Kovil, Dr Gopala Krishnan Nagar"
Grocery_shops,Flango Stores,5.0,4,"avattam Main Road,, Konavattam Vellore, Vellore - 632013, Near Surya Industry"
Grocery_shops,Saleem Store,5.0,3,"mathpala, Allapuram, Thorapadi, Vellore - 632002"
Grocery_shops,A R Traders,5.0,3," TRADERS, 5/4 Khatib Abdul Khadar Street,, Rn Palayam, Vellore - 632001, Near Big Masjid"
Grocery_shops,Janaki Stores,5.0,3,"6, Chavadi Street, Sathuvacheri, Vellore - 632009, Opposite Tamil Nadu Housing Board"
Grocery_shops,Nithins Organic Shop,5.0,3,"No, MBT Road, Walajapet, Vellore - 632513, Opposite to Rani Mahal"
Grocery_shops,Adthi Siddhar Herbals,5.0,3,"co Nagar, Hayath Nagar, Tirupattur, Vellore - 635601"
Grocery_shops,Hms Stores,5.0,3,"upet Road Firststreet, Tirupattur, Vellore - 635601"
Grocery_shops,Sri Valamburi Vinayaka Stor..,5.0,3,"ankarai, Badanavadi, Vellore - 635654"
Grocery_shops,SPB Super Market,4.8,3,"278, Arni Road, Virupakshipuram, Vellore - 632002, Near KVB Bank"
Grocery_shops,Sri Vinayaka Stores,4.8,3,"255, MAin Road, Paradarami, Vellore - 632603, Opposite Bus Stand"
Grocery_shops,Sri Guru Ragevendra General..,4.7,3,"huvachari, Rto Road, Sathuvacheri, Vellore - 632009, Near R.T.O. Office"
Grocery_shops,Raj & Jothi Fish Store,4.7,3,"thamangalam, Vellore - 631051"
Grocery_shops,Noor Stores,4.3,3,"puram, Kosapet, Vellore - 632001"
Grocery_shops,Ragavendra Stores,4.3,3,"avattam Main Road , Konnuattam Main Road, Konavattam, Anna Nagar, Vellore - 632001, Near Kalal Auto Spares"
Grocery_shops,Sri Nataraj Stores,4.3,3,"asalai, Thorapadi, Vellore - 632002"
Grocery_shops,Sri Ram Provisional Store,4.3,3," 120,, Double Road, Sathuvacheri, Vellore - 632009, Near D.V.S. Complex"
Grocery_shops,Sri Aanandha Nayagi Stores,4.3,3,"neshwara Nagar, Vallalar, End Double Road, Sathuvacheri, Vellore - 632009"
Grocery_shops,Shree Krishna Marachekku En..,4.3,3,"visharam, Vellore - 632509"
Grocery_shops,Anbu Stores,4.3,3,"4, Timiri, Vellore - 632512"
Grocery_shops,Venugopal Provision Store,4.3,3,"umbulipakkam, Vellore - 632531"
Grocery_shops,Vvb Store,4.3,3,"nkarai Road, Vellore - 604505"
Grocery_shops,Saravanas Store,4.3,3,"ankarai, Badanavadi, Badanavadi, Vellore - 635654"
Grocery_shops,Ashok Store,4.0,3,"or, Ussoor, Vellore - 632105"
Grocery_shops,Govind Departmental Stores,4.0,3,"dili, Vellore - 635901"
Grocery_shops,R.k.n Agencies,3.8,3," Arni Main Road, Sainathapuram, Vellore - 632001, Palamjaadhukuppam"
Grocery_shops,Chan Basha Provision Stores,3.8,3,"156, Chitoor Road, Katpadi, Vellore - 632007, Near Vallimalai Road"
Grocery_shops,Anbu Departmental Stores,3.8,3,"16, MGC Copmlex, Mgc Nagar,, Alamelumangapuram, Vellore - 632009, Opp to Siva Sakthi Mahal"
Grocery_shops,K V S Provision Stores,3.7,3," 2f, Katpadi Road, Gandhi Nagar, Vellore Ho, Vellore - 632001, Near Raj & Company"
